{
  "metadata": {
    "projectId": "PROJ-1234",
    "courseId": "1234",
    "lmsId": "EDU-1234",
    "courseTitle": "Example Course Title",
    "slug": "example-course",
    "description": "Brief course description.",
    "courseDeveloper": ["Course Developer", "Splunk EDU"],
    "format": [
      {
        "mode": "Instructor-led training",
        "duration": "13.5 hours"
      },
      {
        "mode": "eLearning",
        "duration": "5 hours"
      }
    ],
    "roles": {
      "customer": ["sysadmin", "power user"],
      "internal": ["professional services", "sales engineer"]
    },
    "prerequisites": {
      "courses": [
        "Splunk Enterprise System Administration",
        [
          "Troubleshooting Splunk Enterprise",
          "Splunk Enterprise Cluster Administration"
        ]
      ],
      "competencies": [
        "Linux administration",
        "Networking fundamentals"
      ]
    },
    "ga": "2025-11-01",
    "updated": "2026-01-21",
    "splunk": {
      "platform": {
        "deployment": "Cloud",
        "version": "10.2.1"
      }
    }
  },
  "plugins": [
    {
      "name": "locale-jp",
      "translations": {
        "audience": "Splunkクラウド管理者",
        "duration": "18時間"
      }
    }
  ],
  "input": {
    "courseDescription": "./README.md",
    "labGuides": "./lab-guides",
    "static": "./static",
    "readme": "./ILT-README.md"
  },
  "output": {
    "theme": "splunk-edu",
    "destination": "./dist",
    "pdfs": {
      "courseDescription": "example-course-guide.pdf"
    }
  }
}
